-,Date of Interview,Show #,Title,Video Sent to Tori (David),Video Back from Tori (David),Video Sent to Takeshi (David),Audio Back from Takeshi (David),"Transcribed (Long) 
(Kim)","Transcribed (Short) 
(Kim)",Long Transcript Proofed & Word doc (Margaret),Infographic Text Created (Margo & Margaret),Infographic Text Sent to Natalia (Margo),Infographic Back from Natalia (Michele?),"Infographic Proofed/ Edited 
(M, M & M)",Posted on Web (Michele or Margaret),Social Content created by Andrea (Deborah),Content Shared with Guest (Deborah),Content Shared on Our Social Media (Deborah),Tags including: #humanized #humanizedhealth #humanizedpodcast #yourhealthpersonlized #villagegreenapothecary #myvillagegreen @village_green_apothecary  (April),Invitation Sent to Schedule Next Recording(s) (April) ,Reminder Email Sent to Schedule Next Recording (April),
"Atkinson, Debra",10/5,1,How Exercise Can Make a Woman in Menopause Store More Fat,10/6,10/06,10/07,10/11,10/29,10/29,10/29,11/3,11/12,11/22,11/22,12/20,1/24/22,1/24/22,,"humanized,village green apothecary,myvillagegreen,Debra Atkinson, MS, CSCS, menopause, weight, women's health, wieght loss, exercise",,,"How Exercise Can Make a Woman in Menopause Store More Fat
Rebekah Kelley: Welcome to the Humanized podcast, all about personalizing your health. I am your host, Rebekah Kelley, and today we are discussing How Exercise can Make a Woman In Menopause Store More Fat, with Debra Atkinson. Before I introduce Debra Atkinson, I want to remind everyone to subscribe and get all of our variety of casts in audio, video and transcription at HumanizedHealth.com. I'd also like to thank our lead sponsor, Village Green Apothecary, at MyVillageGreen.com. 
A little bit about Debra Atkinson. She's a wellness coach, hormone balancing fitness expert, best-selling author, podcast host, frequent speaker, TEDx presenter, and the founder of Flipping 50. She is passionate about helping women ""flip"" their second half with the vitality and energy that they want. 
So, thank you so much for being with us, Debra. 
Debra Atkinson: You bet. Thanks so much for being here. Love to talk about this subject and love to address these women. So let's go. 
Rebekah Kelley: Well, I have lots of questions for you. So excited to get smart about this. So, why do so many women gain weight in menopause, specifically belly fat? And all my girlfriends are asking this question, why is this happening to me right now? 
Debra Atkinson: Right. It's one of the first signs. So even for the lucky ones who don't experience hot flashes and night sweats, that is usually one of the first signs. And honestly, until probably 5 years ago, even, and as recently as today, some women still don't put together, oh, my hormones are changing and that's why nothing I used to do that worked works anymore. Those are the infamous words I hear way too many times. 
But the reason is this. That right during peri-menopause, so when we're kind of working our way out of those reproductive years, nature's turning us into a woman who doesn't need that anymore, so we're going to let it go. We have a roller-coaster ride of our estrogen levels, our testosterone and progesterone levels are taking us on a roller coaster, primarily trending down, but there are ups and downs along the way. But when that estrogen comes down, it, number one, has a muscle protecting component, and many women will recognize it has a bone protecting component, because we've talked about osteoporosis now for 25 years as a household word. We all know what that is. But the same is true for muscle. It's very muscle protecting. So if you don't have that protection anymore, you're probably going to lose muscle faster and easier than you gain it, or even maintain it. That's going to make you tend to gain fat easier than you ever did before. 
So that's one piece, but it really comes down to when estrogen comes down, your body naturally, being the amazing machine it is in so many other ways, it turns up cortisol. And it's doing that in effort to say, well, I'll just convert cortisol into estrogen. And now that's a really inefficient way to make that happen. It can only compensate for about 10% of your estrogen. So it doesn't work that way. But what does happen is we're left with more cortisol. And cortisol deposits fat. So it tells your body, store fat, store fat, and your body can't do two opposing tasks at the same time. When in doubt, it's going to say, we must be under some kind of threat. We're going to protect you. So we'll just store a little here for a rainy day – it happens to be raining here in Scottsdale right now, oddly enough. So the combination of cortisol, number one, is bad. There's also the, when we're under stress, I don't know about you, Rebekah, but fewer of us actually crave kale and salmon. You know, we want cake and we want bread and we want, let's say...
Rebekah Kelley: Cupcakes, French fries, wine... [Laughs]
Debra Atkinson: Yeah. Anything that turns to sugar and/ or combines sugar and fat, spikes our insulin. When cortisol and insulin team up together, that is like two belly fat bullies teaming up against you. So we're down and out. So that vicious cycle will happen again. You come off of a crash from having that sugar, you tend to want more sugar and it can be a vicious cycle. 
So we are saying this statement over and over and over. Women in midlife are more susceptible to the negative effects of stress, and stress cortisol, that hormone, is kind of right there at the top of the mountain. So if you want to help yourself do one thing to help decrease belly fat, decrease your stress level. 
Rebekah Kelley: Wow. Well, with all the exercise options available today, why do you think none of them are working? And, I mean, we hear of so many different ones, right? Strength training being in the orange zone... there's so many different kinds. Why are none of them working for us? 
Debra Atkinson: Well, here's the biggest reason. Right now, and this is 2021 so you'd think we'd know better. We're learning. But 39% of all sports medicine and exercise science research features female subjects. So, if you look at politics and you look at job and earnings, you might say, well, that's not terrible, we've heard worse, right? 40, 60... But it gets worse when you think about it this way. So you and I, we go through – or will if we choose to, or are blessed to go through – seven major hormonal changes in our lives. Those seven, every one of them demands a specific exercise prescription. Men don't do that. I mean, men have some hormonal change. They tend to see it, not until their 60s, but they certainly don't have it every month. They certainly don't get pregnant. I haven't seen it yet, right? They don't go through postpartum. Their turbulence at puberty is a lot less likely to be problematic than it is for a female. Those changes... and obviously if we said, okay, well, hormonal change, hormonal change, but no, you would never do the same kind of exercise for a young adolescent woman who wants to play basketball or volleyball and for a post-menopausal or post-partum woman. Those are very different exercise prescriptions. So now let's do the math again: 39% pertains to women. If we divide that by seven, we get less than 10% and it's about 6% of all research, if it's evenly distributed. Now we know it's probably not. But that's very little research on the stage you're in, on the stage I'm in. So if we didn't know to ask, is the program that I'm doing designed based on research on women just like me, we're gambling.
Rebekah Kelley: [Nodding] Can you talk a little bit about fat-burning zone versus fat-burning exercise and just kind of clear up the confusion around that, for me and for the listeners out there? 
Debra Atkinson: Absolutely. So let's just start with, what's really popular today is HIIT, right? So if you do high-intensity interval training, we all know that burns fat. That's a better fat burner, during and after. However, there's still some very old-school people, primarily in bodybuilding or figure competition, and they still believe that doing very low-intensity exercise and doing it without food – which is a whole other interview, we won't open that can of worms – is the best way to burn fat. And the answer to both of those is yes, you burn fat. You burn fat there, too. But we're sitting down for this interview, at least I am. We're burning about 99% fat right now. How well is that working for you? Cause you know, I've been sitting a lot and I'm still not seeing the results, right? So we burn it so slow that it's not ideal.
So when we do high-intensity interval training, we are burning a smaller percent of fat, but we're burning so many more calories that a small percent of a very big number is still burning more fat. But where we get into trouble as women is, all exercises is stress. So we've got to look at, what's your status right now? Do you need exercise, or actually do you need a little less exercise? Some of that low-intensity walking or yoga might end up being fat burning, if that's what you need, because we need to remove the stress because that's the obstacle, versus doing more high intensity. But if you're only walking and you're doing your strength training – go, you! – but you might want to add interval training.
Rebekah Kelley: Well, then that gets into the next question. If you could give a blueprint to a woman in mid-life for the best kind of exercise, what would that be? 
Debra Atkinson: Yes. And let's agree right now that no two women watching this are in exactly the same status. Every woman's journey through menopause is different. Somebody's journey in their late 30s or 40s would be different for somebody in their 70s.
But if we could say, okay, here's a guideline. Now, it's only a blueprint. What's true for you. Go through one of those quizzes like you were a teenager – if this, yes, okay, go over here, if no, go over here. So, it would be two full-body, total body strength training sessions every week, putting about 72 hours between them, Monday and Thursday. So you want to ditch that Monday, Wednesday, Friday schedule. Don't fit into the clubs' schedule, create your own, and then do one to three short high-intensity interval training sessions. When you start, you can increase to two or to three, as you progress and find what's working. I'm feeling good. I like doing this. No injuries. So, those. You want to consider, you have 45 minutes in your interval bank every week. Not every session – every week. So you could do three 15-minute sessions plus a warm-up and cool-down, or two 25-minute sessions, 20, 25 minutes warm up and cool, and you're good to go. 
And you also don't have to reach that quota. We tend to hear, oh, up to that much, I should do at least that much. [Laughs] Right? Cause more must be better. So we've got to stop that crazy ""if it's not working, I'll do more of it"" kind of attitude. You should already be getting a hint you're feeling better, before you start to dial up the intensity. 
That, and then moderate exercise, low to moderate walking every day. Be someone who moves regularly. That's really the key. 
Rebekah Kelley: Wow. Thanks Debra Atkinson, those are really valuable insights. Debra Atkinson can be found at www.DebraAtkinson.com. I'm going to spell that. D E B R A A T K I N S O N.com. And let me remind you to subscribe, to get access to all Humanized videos, podcasts and transcriptions from all of our thought leaders on personalized health at HumanizedHealth.com.
Thank you so much. That was wonderful. 
Debra Atkinson: Thank you."
"Atkinson, Debra",10/5,2,How Can Hormone Balancing Exercise Support Women in Menopause,10/6,10/12,yes,10/14,12/7,12/7,12/7,12/15,12/22,1/6,1/6,2/7,,,,"humanized,village green apothecary,myvillagegreen,Debra Atkinson, MS, CSCS, women's health, menopause, exercise, hormones,",,,"How Can Hormone Balancing Exercise Support Women in Menopause?
Rebekah Kelley: Welcome to the Humanized podcast, all about personalizing your health. I&#39;m
your host, Rebekah Kelley, and today we&#39;ll be discussing How Can Hormone Balancing Exercise
Support Women in Menopause, with Debra Atkinson. Before I introduce Debra Atkinson, I want
to remind everyone to subscribe and get all of our variety of casts in audio, video and
transcription at HumanizedHealth.com. I&#39;d also like to thank our lead sponsor, Village Green
Apothecary, at MyVillageGreen.com.
A little bit about Debra. She&#39;s a wellness coach, hormone balancing fitness expert, best-selling
author, podcast host, frequent speaker, TEDx presenter, and founder of Flipping 50. She is
passionate about helping women &quot;flip&quot; their second half with the vitality and energy that they
want.
Thank you so much for being with us, Debra.
Debra Atkinson: Thank you for having me.
Rebekah Kelley: It&#39;s a complete pleasure and I&#39;m really excited to talk about this. So I just want
to go ahead and say, women in menopause, a lot of my friends, complain about weight gain,
belly fat. They say, look, I&#39;m exercising, I&#39;m doing all the right things. What&#39;s going on? Debra,
can you break down, and just let us know, what are the mistakes that we&#39;re making?
Debra Atkinson: Well, the biggest mistakes are the way we tend to exercise. So we tend to,
number one, do something I believe would be labeled as insanity. We&#39;ve got something already
we&#39;re doing, it&#39;s not working and we decide, I&#39;m going to do that more, I&#39;m going to do it longer,
I&#39;m going to do it more frequently. And that&#39;s probably the wrong approach. So we should be
getting the right support, right idea. We&#39;re feeling better. We&#39;ve got more energy. We&#39;re
sleeping better. Even if the scale isn&#39;t changing and that&#39;s our goal, we should have hints, some
breadcrumbs, that we’re on the right path.
Here&#39;s what women tend to do. We&#39;ve been conditioned. Right now, women still, who were in
menopause and/or beyond, have been conditioned for decades that endurance and cardio
exercise of any kind – high intensity, moderate intensity, low intensity – is the best way to burn
more calories, which we equate with burning more fat.
However. In midlife, that all backfires because we don&#39;t have those hormones there to help us.
Estrogen isn&#39;t there, we&#39;ve got lower testosterone. They don&#39;t help us get the muscle. So what
we need is to get the muscle. We need to spend more time in the strength training room and
drop those fears that we&#39;re going to bulk up, right? And a lot of women still have that fear. I&#39;m
loving the fact that I see 20- and 30-somethings in the weight room now, females, more than
ever. And I love that. But the gap still occurs in women in their later 30s and 40s and 50s and

beyond because we&#39;re new to it. We&#39;re intimidated by it. If that&#39;s the first time you stepped into
a gym, it doesn&#39;t matter if you&#39;re a CEO of your life everywhere else. If you step here and you&#39;re
intimidated, it&#39;s still a first time. So we need to shift that. Less endurance exercise, more
strength training exercise.
And the reason is, less endurance because endurance exercise will spike cortisol. After about an
hour, definitely 75 minutes, we see cortisol continue to go up and it doesn&#39;t have a
corresponding down. It just stays up, which means you&#39;re storing fat. We need to switch that
time and do strength training so we can gain the lean muscle tissue that boosts metabolism.
And strength training tends not to have that sharp spike for cortisol. So it&#39;s actually a way to
feel more powerful inside and outside and get the results you want.
The last one came up this past year during the pandemic. So, what women had been told also,
this is a hangover from actually the late &#39;80s – moderate exercise. You know, you&#39;ve heard, all
things in moderation. Including our exercise. That has been replaced by science so many times,
but we still default to that old dogma. And unfortunately doctors still will give that advice if
they themselves are not more schooled or regular exercisers themselves. They&#39;re still saying
moderate exercise, because it&#39;s a safe answer to give their clients and not get too specific. But
here&#39;s the real way we turn that around and make it true. We need moderate amounts of all
kinds of intensity of exercise. We need moderate amounts of low intensity and really high
intensity. We need to get breathless.
Rebekah Kelley: I love that. How much does timing of exercise matter? I mean, obviously, the
best time to exercise is going to be when you&#39;re going to do it, but does timing make a
difference? Is there actually a better time to go do some exercise?
Debra Atkinson: Yeah. Love you, but I&#39;m going to argue with you. [Both laugh] So, here&#39;s what
we do know. In menopause, midlife, it changes. And it may actually be opposite that. The best
time to exercise is dependent on the type of exercise you&#39;re going to do. So, one of the mantras
at Flipping 50 is, &quot;Intense early, light late.&quot; To remember that little alliteration. But here&#39;s why.
You want to work with your hormones, not against them. So, cortisol naturally, if it&#39;s working
correctly – and that&#39;s not true for everybody – is highest in the morning at 8:00 am. That should
be what, if you could not get up to that alarm clock, if you could wake up naturally, it would be
cortisol that&#39;s waking you up. Most of us will probably agree we&#39;re more productive, we&#39;re
better thinkers, we do the creative stuff early in the day because... we can get things done in
the afternoon, but we may not have that creativity. We just don&#39;t have that kind of focus the
way we did earlier. That&#39;s thank you to cortisol. So it&#39;s a good guy as well as a bad one. But we
want to exercise when our cortisol is high because it&#39;s also our energy hormone. And the reason
is, if you exercise late day, say you get off at 5:00 and you do that high-intensity workout that
was scheduled, and you do it at 5:30 pm, your body is already low on cortisol. You&#39;re preparing
for relaxing and calmly getting yourself ready to sleep, which is as it should be. But what you do
is stir the pot and your body doesn&#39;t have cortisol for energy, so it says, well wait, I&#39;ll convert
this other hormone called pregnenolone into cortisol. So now you&#39;ve got energy and you&#39;ll

finish and say, Debra, don&#39;t know what you&#39;re talking about. Did my workout just fine. It was
great. But 4 hours later, when you&#39;re ready to wind down and go to sleep, pregnenolone&#39;s job is
to help you calm down and do that. But you&#39;ve already written checks on that account and you
may not sleep well. And that will come back to bite you, you know where.
Rebekah Kelley: Well, and I love to sleep and I know most of my friends do too, and it&#39;s a little
bit of a challenge sometimes, so, got it. Okay. Calmer in the evening.
You&#39;ve also hinted at some guidelines you use with your Flipping 50 community. Would you
share some of those tenets with us, help make us smart about what we should be doing?
Debra Atkinson: Yeah. Well, absolutely. So tenets, or the 10 commandments, however you like
to think about them. Okay. So number one, and number one on purpose is, &quot;Restore before
more.&quot; We are all more likely, if we feel like we&#39;re gaining weight, we can&#39;t lose the weight or
we&#39;re getting into belly fat or cellulite, we&#39;re more likely to try to do more, even though we&#39;re
exhausted. And that exhaustion is telling you that your adrenal system may not be working
ideally, your cortisol is amped or imbalanced, and we&#39;re not going to make it better by doing
more and adding more exhaustion to it.
So you&#39;ve got... you&#39;re driving down an interstate and there&#39;s road construction. There&#39;s no
shoulder and you can&#39;t pass. You&#39;ve got to get through it. Go slow first, and then you can go
faster. Right? So the same is true with exercise. You&#39;re going to get better results if you rest up,
restore, take care of them.
Number two is, &quot;Intense early, light late.&quot; We&#39;ve talked about that. So interval early. Do your
yoga, go for a walk later and that will not put you a workout behind, necessarily. It will
potentially remove the obstacle to you getting the results you want.
&quot;Sleep deep.&quot; So doing those first two will help that, but you&#39;ve also got to prioritize it. So
sometimes for women it&#39;s, we can &quot;one more thing&quot; ourselves right out of an hour or two of
sleep, right? So we&#39;ve got to really say, oh no, this is really important. And I don&#39;t need to finish
this show. I actually need to just go to bed.
The next one is, &quot;Rest best,&quot; and that&#39;s tied into sleep, but rest between workouts. When we&#39;re
over 40, definitely over 50, more of us, at least you compared to you, me compared to younger
me, we need more rest between the exercise to benefit from it. It doesn&#39;t mean we can&#39;t work
out just as hard as we want to. In fact, we need intensity more than we ever did when we were
younger, but we need to take more recovery. So, 72 hours between strength, instead of 48, is
actually a better rule of thumb.
And then, &quot;Go pro.&quot; So this is a controversy with some people I know, but we need more
protein. We need adequate amino acids. They are the building blocks of muscle. And when we

look at osteoporosis, we also see frailty as a problem because frailty leads to falls, which leads
to the fractured bones. Frailty happens from a loss of muscle mass. We need to keep that
muscle mass. The protein is necessary in order to help the strength training. Get the benefits
that you actually deserve from it.
The next one is, &quot;Breathless.&quot; So, interval training, we&#39;ve talked a little bit about. Definitely, you
need to get breathless more than you just need to go for another walk around the block. Life
sometimes is an interval train. But we need to literally reach breathlessness. So it doesn&#39;t have
to be complicated. You can walk up a steep hill and do that. You can get on an exercise bike,
you can do it in a swimming pool. So many ways to turn any exercise into interval training. And
it&#39;s a few minutes, not very long.
The next one is, &quot;Reach fatigue.&quot; So when you&#39;re strength training, number one, put down the
pink dumbbells and nobody gets hurt. You need to pick up something heavy. But you need to
reach muscular fatigue. That&#39;s very different than just being tired at the end of a workout.
Muscular fatigue in every set, whether you&#39;re doing two repetitions, 10 repetitions or 20
repetitions. That helps your muscles.
&quot;Stress less.&quot; So whether it&#39;s emotional stressors, your finances... You know, we couldn&#39;t
remove a pandemic, but we hopefully could remove some of the other things that are
bothering us and/or we find joy. Find joy, find laughter, find ways to offset it, and then eat
more and exercise less. That&#39;s just an easy statement and it is the opposite of the dogma. So I&#39;m
going to repeat it. Eat more of the right things, exercise less. Just make it quality when you do
it.
And the last one is, &quot;Choose joy over calories.&quot; If I had a dollar for every time as a fitness
instructor I had been asked, how many calories did I just burn in this class? Right? You know,
that kind of exercise typically doesn&#39;t stick. We need to choose, I love this, that&#39;s why I keep
continuing to do it.
Rebekah Kelley: Wow, I love that. Thanks, Debra. Those are really valuable insights. Debra
Atkinson can be found at www.DebraAtkinson.com. I&#39;m going to spell that. D E B R A A T K I N S
O N.com. Let me remind you to subscribe and get access to all Humanized videos, podcasts and
transcriptions from all of our thought leaders on personalized health at HumanizedHealth.com.
Thanks so much for being with us. That&#39;s all great information.
Debra Atkinson: Thank you so much for having me."
