"O'Bryan, Tom",8/12,3,Personalized Approach to Microbiome Health,yes,8/30,yes,9/4,9/8,9/9,9/8,9/9,9/16,9/24,9/27,10/11,,1/26/22,,"humanized,village green apothecary,myvillagegreen,Tom O’Bryan, microbiome, gut health, digestion, digestive, inflammation,",,,"Personalized Approach to Microbiome Health
Rebekah Kelley: Welcome to the Humanized podcast, all about personalizing your health. I am your host, Rebekah Kelley. And today I'm thrilled to have our guest Dr. Tom O'Bryan on the show, and we'll be discussing a Personalized Approach to Microbiome Health. Before I introduce Dr. O'Bryan, I want to remind everyone to subscribe and get all of our variety of casts in audio, video and transcription at HumanizedHealth.com. I'd also like to thank our lead sponsor, Village Green Apothecary, at MyVillageGreen.com. 
And a little bit about Dr. Tom O'Bryan. He's a recognized world expert on gluten and its impact on health. He is an internationally recognized and a sought-after speaker and workshop leader, specializing in the complications of non-celiac gluten sensitivity, celiac disease, and the development of autoimmune diseases as they occur inside and outside of the intestines.
Thank you so much Dr. O'Bryan, for being here with us. 
Tom O'Bryan: Thank you. Thank you. It's a pleasure. It's really a pleasure and thank you for what you're doing, carrying this message out to the world. 
Rebekah Kelley: Love it. Love sharing. I've just actually finished your book, You Can Fix Your Brain, and now I've opened it back up and I'm on reading it the second time. You have so much to share, so we're so glad you’re here to talk about this. 
Tom O'Bryan: I tell people, just open the book to any page, read one paragraph. If it doesn't grab you, don't buy the book. It should be that way. It should be, what? What did he just say? So, thank you. 
Rebekah Kelley: Thank you. So let's jump right in and give a little teaser. So what constitutes a healthy gut microbiome? 
Tom O'Bryan: What we have to understand is the importance of a healthy microbiome. 36% of all the small molecules in the bloodstream at any one time, over one-third of everything in the bloodstream, is the metabolites or the exhaust of the microbiome in the gut. I call it exhaust. But these bacteria produce metabolites and these metabolites go into the bloodstream – one-third of everything in the bloodstream. Why? They're messengers. And the messengers, we know for every one message from the brain going down, telling the gut what to do, there are nine messages from the gut going up, telling the brain what to do. The ratio is 9 to 1. That's why the gut is called the second brain. And those messages tell the brain, make this amount of neurotransmitter, brain hormones like serotonin, make this amount of melatonin, make this much brain-derived neurotrophic factor. All of these different hormones that balance the brain are produced in the volume that is controlled by the bacteria in your gut. So, if you have too many of the wrong type of bacteria in your gut, sending a whole lot of their messages, overpowering the messages coming from the good bacteria in the gut, you make too much imbalance of neurotransmitters in your brain, you get depression, or you get anxiety. Just go to Google and type in depression and brain function and look at all the studies that come up – because scientists are just blown away by this. 
So what makes a healthy gut? It's the balance of so many of the good bacteria and not too many of the bad bacteria.
Rebekah Kelley: So what factors can influence then, one's microbiome composition? 
Tom O'Bryan: Oh, it starts with being in mom's womb. We know now that mom's microbiome implants into baby in utero, so baby's initial bacteria in their gut are determined by mom. And that's why we talk about the generational influence on our health, that we can be carrying bacteria from mom, from her mother, from great-grandmother, that those concentrations of bacteria can influence how baby's brain is developing. So it starts in utero. Then the birth process, if you have a natural childbirth, we know in the last month of pregnancy, the bacteria in the vaginal tract completely changes and it becomes very dominant in something called Prevotella. Prevotella, and it's not hardly identifiable at any other time in a woman's life, only in that part of pregnancy in the vaginal tract. Why? Prevotella carries the messages as baby's coming down the birth canal covered in all of the juices of the reproductive tract. The bacteria is getting in the eyes and the nose and the mouth, baby swallowing it. And it's saying, okay, here's the code of the person who's going to be feeding you. So here's the code of the food that's going to be coming, so let's make these digestive enzymes, stomach and pancreas, let's start making these enzymes and bacteria in the gut. Let's start colonizing more of these. And that's what the bacteria in the vaginal microbiome does. 
So when baby is born by a natural childbirth, baby's getting the right messages. When baby unfortunately needs to be born by a Cesarean section, like our son – it was a traumatic birth and he's really healthy now, but at that time, a last-minute emergency, born by C-section – the microbiome that he was born with was highly compromised. The studies are really clear. If you're born by C-section, the microbiome that becomes dominant in baby's gut is the microbiome in the emergency room, in the operating room. And in hospitals, there's lots of bad bacteria, and it's in the air and it's on the gloves. They put clean gloves on and clean gowns, but they've got those bacteria that's in the room. And that becomes the dominant bacteria in baby at birth. So many babies are born with a deficit. 
Then, during the course of infancy and childhood, some babies, some children, require antibiotics for one reason or another. Antibiotics can be lifesaving. If they're important, you take them, but you have to recognize that the antibiotics don't just kill the bad bacteria. They also kill the good bacteria. And so if you have to take antibiotics, you need to do an aggressive approach to rebuild the natural microbiome. 
And then it goes on from there, with the foods that we eat, the house that baby lives in, the air that baby is breathing. There are so many influences on baby's microbiome that it takes mom or a family months to learn all of this and to begin adapting and transitioning their lifestyle to create a healthier environment for the family. You don't pick this up by taking one pill. Well, I'll take a probiotic. Well, that's going to help a little bit, but it doesn't fix everything. Right? So there's a whole game plan that you have to develop to rebuild a compromised microbiome or to maintain a healthy, balanced microbiome. 
Rebekah Kelley: Wow. So what is the best way then to test or understand your own microbiome? 
Tom O'Bryan: There are a number of good tests out there, but the bottom line is test the poop. Because... my mentor, Dr. Jeffrey Bland, and my friend, the founder of functional medicine, he says Tom, one teaspoon of poop has more bacteria than all the stars in the known universe. And he doesn't exaggerate. If we think of the numbers, that the best that we can do is look at, okay, what's the signature of this person's microbiome? Who are the dominant players? What are the most messages in the stool analysis that we're looking at?
So the test that we really like is called the Gut Zoomer because you zoom in on the problem. But there's a number of good tests out there that you can use. But the point is you have to check the poop to get an idea of what the environment in the gut is doing right now. 
Rebekah Kelley: So once you understand then your own microbiome, I'm assuming then you're going to tailor something to then fit what you need to do to optimize your microbiome health, right? How would you go about doing that?
Tom O'Bryan: The rule is, it's really simple and it's the basis of functional medicine. The rule is, get the bad stuff out and put the good stuff. If you don't know what's there, you don't know, and you shotgun. You go, well this is good. Studies say that this probiotic is good, let's give him some of that. And well, maybe we'll change it with this probiotic, let's give him some of that. And that's helped. I mean, I did that for many... You know, starting in 1980, when I opened my practice, we were talking about these bacteria with names like lactobacillus acidophilus and bifido bacteria. I mean, it's Greek. It's Greek. It sounds like Klingon language and you don't know whether to welcome them or shoot them. You don't know! But now we know more.
And so it's really important, if you have a health concern, that you get a big picture overview of what's going on in your gut right now. That's critically important. So once you understand it, you've got, oh look, it says that I've got too many families of bad bacteria, and they're really a strong message, which means their exhaust is getting into your bloodstream and they're sending messages to the brain, to the joints, to the skin, to your heart, directing a more inflammatory environment. And we know all disease, in all chronic diseases inflammatory in nature, well, if you want to deal with a chronic disease, irrespective of what it is, reduce the inflammation. And the first, the FIRST place you have to go for that is the gut. 
That's why at Harvard, our gastroenterologists and immunologists in the medical school are being trained right now. And the head, the chief of pediatric gastroenterology at Harvard just published a paper, All Disease Begins in the ""Leaky Gut."" All disease begins in the gut. That's how important it is to address the gut. That's why this topic is so critically important for everyone's health, for them and their family. 
Rebekah Kelley: Wow, thanks, Dr. O'Bryan, those are really valuable insights. Dr. Tom O'Bryan can be found at www.TheDr.com. That's T-H-E-D-R.com. Let me remind you to subscribe and get access to all Humanized videos, podcasts and transcriptions from all of our thought leaders on personalized health at HumanizedHealth.com. Thank you so much for being with us."
"O'Bryan, Tom",8/12,4,The Gut/Brain Connection,yes,8/31,yes,9/4,9/8,9/8,9/8,9/9,9/16,9/24,9/27,11/22,,1/26/22,,"humanized,village green apothecary,myvillagegreen,Tom O’Bryan, DC, gut health, brain health, microbiome",,,"The Gut/Brain Connection
Rebekah Kelley: Welcome to the Humanized podcast, all about personalizing your health. I am your host, Rebekah Kelley. Today I'm thrilled to have our guest Dr. Tom O'Bryan on the show, and we'll be discussing the Gut/Brain Connection. Before I introduce Dr. O'Bryan, I want to remind everyone to subscribe and get all of the variety of casts in audio, video and transcription at HumanizedHealth.com. I'd also like to thank our lead sponsor, Village Green Apothecary, at MyVillageGreen.com. 
A little bit about Dr. Tom O'Bryan. He's a recognized world expert on gluten and its impact on health. He's an internationally recognized and sought-after speaker and workshop leader, specializing in the complications of non-celiac gluten sensitivity, celiac disease, and the development of autoimmune diseases as they occur, inside and outside of the intestines.
Thank you so much for being here with us. 
Tom O'Bryan: Oh, thank you. It's a pleasure. Thank you. 
Rebekah Kelley: So tell us about some of the ways the gut and the brain communicate with each other. 
Tom O'Bryan: Oh, my goodness, how much time do we have? [Laughs] The first way that the gut and brain communicate is that the bacteria in the gut, they're just like your muscle cells – you exercise too hard, you're sore from the lactic acid and that irritates the muscles. That every cell has an exhaust, when it works. The bacteria in your gut have an exhaust, it's called the metabolites of the bacteria. And over one third of all the small molecules in the bloodstream are the metabolites from the bacteria in the gut. It's, what? One third of everything in the bloodstream is the exhaust from the bacteria in the gut? Yes. Why? Well, that's the million dollar question. And it turns out that the bacteria in the gut – now here comes a geek word – modulates how the brain functions. Now, what does that mean? Modulates means you have your hand on the steering wheel, you're driving down the road, and if you turn the steering wheel five degrees to the right, 50 yards down the [road]... you're off the road! So ""modulates"" controls the balance of brain function, that the gut microbiome controls the balance of the brain hormones called neurotransmitters that your brain makes, that's regulated or modulated by the gut microbiome. That's that first way.
The second way is that... we learn this with Parkinson's, and the first studies came out about 2008, 2009, that Parkinson's patients, their disease starts 20, 30 years before they ever have a symptom. And it starts in the gut. That the misfolding of these proteins called alpha-synuclein, the twisting of these proteins occurs from the bacteria in the gut, too much of the wrong bacteria, bad bacteria. And this misfolded protein goes right through the walls of the gut into the tissue inside, and they grab onto the nerves in the gut and they creep up the nerves, neuron by neuron, like the itsy bitsy spider went up the water spout, that they creep up neuron by neuron. They don't go out to the side. This misfolded alpha-synuclein just goes up the neurons back into the spine, up the vagus nerve into the brain. And then it gets in the brain, and this misfolded protein has a magnetic pole to the area of the brain. It accumulates there, causes inflammation. Eventually the inflammation kills off brain cells. Here comes Parkinson's. So the bad bacteria in the gut, 20, 30 years before symptoms are producing the nasty that we all know is involved with Parkinson's, alpha-synuclein. So that's the second way. 
The third way is if you've got a leaky brain. Now, most people have heard of a leaky gut, so let me give you the analogy there. Mrs. Patient, your guts, 20, 25 feet long, kind of winds around in the center there and the inside of the gut, it starts at the mouth, goes to the other end, one big, long tube. The inside of the gut is lined with cheesecloth. So when you're eating food, you swallow food. It's in the tube, it's not in the body. Think of a donut. If you could stretch one donut way out and you look down the center of that donut, that's what your digestive tract is. So when you swallow food, it's in the tube. It's not in the body yet. It's got to go through the walls of the tube to get into the body. That's absorption of our vitamins and minerals, our proteins and fats and all that. How does that happen? Digestive enzymes act like scissors to cut it smaller and smaller and smaller and smaller and smaller until the molecules are so small, they go right through the cheesecloth into the bloodstream. But when you get tears in the cheesecloth, now you get bigger molecules getting through the tear before that food's been broken down small enough to get through the cheesecloth. Those molecules are called macro molecules, big molecules. They get in the bloodstream and they activate your immune system, say whoa, I better fight that! So that's what leaky gut is. And that's why the leaky gut is the gateway in the development of all chronic inflammatory diseases.
Now what you need to know about this is if you've got a leaky gut, the tissue that makes up the boundaries of the gut that open and close to let in little molecules and nothing bigger than that, those tissues, it's the exact same tissue that surrounds the brain. And so if you create a leaky gut and that's the proteins called zonulin, and if you have antibodies to zonulin, zonulin is also in the brain, the barrier of the brain. So when your body's making a leaky gut, it's also making a leaky brain. Now, when you get a leaky brain, you get bigger molecules in the bloodstream that aren't supposed to be able to get into the brain, but now they get into the brain. And then the immune system of the brain, trying to protect you, activates inflammation to kill those invaders. Now you've got inflammation in the brain. And then you get collateral damage in the brain and brain tissue starts being affected. 
So that's the process that goes on with Parkinson's and Alzheimer's and depression and anxiety and schizophrenia and bipolar disorder. That mechanism is similar in those different conditions. It just depends on what area of the brain is going to be affected. So the first thing you do with a brain dysfunction is heal the gut because when you're healing the gut, you're also doing the protocols to heal the blood-brain barrier. 
Rebekah Kelley: Awesome. So the microbiome's impact on the gut that then goes to leaky brain, right? Leaky gut, leaky brain. Then that is impacting mental health, right? 
Tom O'Bryan: Exactly. 
Rebekah Kelley: How does it do that? 
Tom O'Bryan: It's the inflammation in the brain. The first thing it does is the inflammation in the brain that causes the tissue not to function the way it's supposed to. And if you have too many of the wrong messengers modulating your brain function, you don't make enough serotonin or melatonin or GABA, or any of the brain hormones called neurotransmitters. They're just out of balance. And by definition, when they're out of balance, you've got brain dysfunction. It might be diagnosed as schizophrenia. It might be diagnosed... Just go on Google and type in schizophrenia and gluten and see all the studies that associate the two. And not every schizophrenia, but many of them, you put them on a gluten-free diet, they get better because gluten was the trigger for that person, creating the leaky gut and the leaky brain. And there's just so much to this field, you know, there's so much to learn, but first the big kahuna picture is that the gut has a direct impact on the brain. 
Rebekah Kelley: Wow. So how can you then optimize this gut-brain connection?
Tom O'Bryan: By healing the gut. Hippocrates said it thousands of years ago, heal the gut. And now at Harvard Medical School, they're doing the same thing. They're teaching the gastroenterologists that all disease begins in the gut, and in the leaky gut. All disease begins in the leaky gut. So you have to learn, okay, do I have a leaky gut? And when you find out you do, okay, how do I repair the leaky gut? And there's a long process. It's not a simple pill to take, you know? You can't take a pill and keep living the life you've been living, expecting a different result, right? Something about how we're living our life, the food that we're choosing, the air that we're breathing, something is triggering the inflammation that's causing the leaky gut, the leaky brain dysfunction. So you have to investigate, you have to identify what is it that for me or for my son or for my family in general, what is it that's contributing to the dysfunction that we're having? And you... oh my God, really? Mold? Yeah, my mold test came back positive. My husband's mold test came back positive. But we don't have any mold. Yes, you do. Did your basement ever flood? Well, yeah, that was 3, 4 years ago. Yeah. And the drywall in the basement got wet and the backside of the drywall that you can't see, grew mold. And so you're breathing mold.
Those are the types of things you have to investigate for. Are there food sensitivities, are there environmental sensitivities, is there too much... My son got really sick when he was 8 years old and we were trying to figure out why is he so tired, why is he so anemic, what's going on here? He had elevated antibodies to fibrinogen. That is really rare. And fibrinogen is a good thing. But he had elevated antibodies. Where'd that come from? My gosh. And so I'm investigating, investigating. He had high mercury, and mercury was causing the antibodies to the fibrinogen, which was causing the anemia, which was causing the fatigue. Mercury! Where did the Merc... oh my God, really? Really? And back then, this was in early 90s, we were just hearing that tuna tends to have mercury in it. Now all tuna, almost all tuna has mercury in it, unfortunately, but it's true. Back then, we were just hearing about this. And I realized, oh my gosh. When my son did something really good and he wanted a reward... what would you like Jason, this or this? And he always wanted to ride his bicycle up to the corner Subway and get a tuna fish sandwich, you know, a foot-long tuna fish sandwich. So he was getting that maybe once a week or something, I don't know, but it was the tuna fish that gave him the mercury toxicity.
My point is, the trigger in the outer world that's creating the inflammation in your body has to be looked for, investigated. That's what you have to do when you're dealing with a brain dysfunction problem. Where is the inflammation coming from? 
Rebekah Kelley: Thanks Dr. O'Bryan those are really valuable insights. Dr. Tom O'Bryan can be found at www.TheDr.com. That's T-H-E-D-R.com. Let me remind you to subscribe and get access to all Humanized videos, podcasts and transcription, from all thought leaders on personalized health at HumanizedHealth.com."
