"Matthews, Julie",4/29,1,Personalized Nutrition is the Key to Health and Healing,yes,5/8,---,"5/20
Margaret",5/20 ML,5/20 ML,5/20,5/24,---,done in-house,5/24,5/24,6/14,6/14,6/29,Julie Matthews discusses the importance of a personalized diet in order to promote health and healing. #personalizednutrition @juliematthewsnourishinghope,6/18,6/21,"Personalized Nutrition is the Key to Health and Healing
Rebekah Kelley: Welcome to the Humanized podcast, all about personalizing your health. I'm Rebecca Kelley, your host, and I'm so excited to share with you our guest, Julie Matthews, and the topic is going to be, Personalized Nutrition is the Key to Health and Healing. But before I introduce Julie, I want to remind everyone to subscribe, to get all of our variety of casts and audio, video and transcription at HumanizedHealth.com. I'd also like to thank our lead sponsor Village Green Apothecary at MyVillageGreen.com. 
So a little bit about Julie Matthews. She's a certified nutrition consultant and published researcher specializing in complex neurological digestive and immune conditions, most notably, autism. She is the author of the award-winning book, Nourishing Hope for Autism, and co-author of a study providing the efficacy of nutrition and dietary intervention for autism, published in the peer review journal Nutrients. Julie's approach is based on the personalized nutrition needs of each person and stems from her 20 years of clinical nutrition experience and research. Her methodology of BioIndividual Nutrition® helps individuals and practitioners who work with a wide range of disorders for adults and children improve health and healing. Julie has a private nutrition practice in San Francisco, California, and supports families and clinicians from around the world with her nutrition learning tools and professional training courses. For more information, you can actually reach her at NourishingHope.com and BioIndividualNutrition.com. 
But let's go right into getting this information, because it's very valuable and very interesting. So Julie, welcome. 
Julie Matthews: Thank you, Rebekah. I'm so glad to be here. 
Rebekah Kelley: It's so great to have you. I just want to jump right into the questions and get right to the good stuff. So what do you mean by personalized nutrition? I've heard that term, but what does it really mean? 
Julie Matthews: Yeah, this is a great question because most people think, ""Oh, of course, you know, I do nutrition, so it's personalized nutrition,"" but nutrition has changed a lot over the years. In personalized nutrition, we're getting very specific about being able to tailor the diet and nutritional needs to the person. So when I think about it, I think about bio-individuality, or biochemical individuality, and looking at each person's unique underlying factors – environment, biochemistry, genetics – and tailoring the diet and nutrition choices very specifically to them.
So instead of one diet, you know, you always hear about the diet of the day, right? Maybe one year it's this, one year it's that. But the truth is that those diets all have something valuable for somebody, which is why those people are so passionate about that diet. But then for every person that I would see where that diet would be helpful, there'd be somebody that that diet wasn't helpful for. And so I really learned as I was working with people that you really need to tailor the therapeutic diet, or combination of therapeutic diets, to the unique needs of that individual. So really that's what personalized nutrition is looking at, all of those different factors, and then customizing the diet and nutrition approach very specifically.
Rebekah Kelley: But how did you discover this? How did you discover the power of personalized nutrition? 
Julie Matthews: So, I'm a certified nutrition consultant and actually a published researcher, as well. And when I was working with clients, I started to realize that, as I was kind of saying, one person would come in and they'd get great results with a diet and another person would come in and they wouldn't.
My specialty is actually autism. And so I had a very core group of people that I was working with where I could very specifically look at this one group of people and learn everything about 10 of... of course, again, everybody's unique and everybody has different factors, but I was able to look at this one condition, and these people that were part of this had kind of one set of symptoms, and really look at what helped them and what didn't. And then I would figure out, okay, well, when did this particular diet help these people, under what circumstance, what underlying factors, what common symptoms did they have that improved, and which ones didn't, and why? And so I discovered really early on that there wasn't one diet for everybody, that everybody was unique. Even within this one condition, everybody was so different, and I was able to see when to use a diet for which person. And when I was able to tailor a diet to the individual needs of that person, I saw really, really great results. And so that's what had me seeing that everybody was unique and really needed this unique approach.
Rebekah Kelley: Wow. Now, are there some basic principles that work across individuals, or one diet that's best, or is it truly completely unique and very different? 
Julie Matthews: Oh, you have a very good point there. There are some things that are typically similar among most people. Again, once I say that, there are going to be outliers. For example, usually vegetables are really good. We might need to tailor which vegetables somebody can tolerate. Some people can't handle FODMAPs. Some people can't handle salicylates. Some people can't handle oxalates. Some people do best with the carnivore diet. But for the most part, most of us do well getting good vegetables in our diet. 
So that's a principle. Getting organic food, getting out the junk food, the artificial additives, food colors, artificial flavors, preservatives, taking out MSG, genetically modified foods, pesticides. Humans don't do well with things that aren't natural because we weren't made to be able to tolerate them. So that's usually something that's good for most of us, getting those good organic vegetables in. 
Getting good quality animal foods usually are beneficial for most of us because they have all the amino acids we need that can help with growth and repair. And we want to make sure they're as nutrient-dense as possible and free of all of the additives. So we want them to be pasture-raised, raised in a way where they're going to be as healthy as they can be.
Getting good fats for the brain is really going to be beneficial. And I like a wide range – some fish oils, some animal fats, some plant-based fats. Again, everybody's going to have a bit of a different ratio of what they need, but overall, getting good quality protein, fats and vegetables is good for most of us.
And then we can tailor it from there. As I said, maybe some people are going to do better with a low salicylate diet, or a low histamine diet, or a low oxalate diet, or a low FODMAPs diet, or a grain-free diet. But yeah, there are some principles that generally I think that most of us can do and then we can customize it and personalize it from there.
Rebekah Kelley: Thank you. So when you are teaching parents or other individuals, or maybe even training practitioners, what dietary approaches do you teach? 
Julie Matthews: So I teach many of the ones I kind of alluded to there. So I'm looking at ones that are going to be... gluten-free is a big one, dairy-free is a place I often start out with. Gluten is very inflammatory to the gut and Dr. Alessio Fasano discovered zonulin, which is a protein that we have that regulates our gut and whether it's leaky, or whether it's nice and protects us from things that we don't want to get in and is properly permeable. And he found that gluten causes this zonulin protein to really create leaky gut in all of us, regardless of whether we're celiac or have a really strong reaction. So being careful of gluten, I think, is prudent for most of us. 
There's actually an interesting study on pregnant women and looking at how much gluten they had. I'm trying to remember the effect, but I remember it was, I think the borderline here was like one piece of bread or something, and found that women that had more gluten had children with more challenges. And I think it was a challenge related to their blood sugar. I'm forgetting the exact study results now, and I don't necessarily recommend eating a piece of bread every day, but the point was, the more people ate, the more challenges resulted. And so I think the less gluten that most of us can eat, the better.
So gluten-free diets, I find, especially with the population I work with – children with ADHD and autism – gluten-free is really important, and dairy-free. They are two of the most common inflammatory proteins. And then from there, I like to help people take kind of a step-by-step approach. You could go straight to the ketogenic diet, but it's a very restrictive diet. And if we don't need to go into ketosis and go all the way there and limit our carbohydrates that significantly, we can go step by step our way. So maybe we start with gluten-free, then maybe some people go to grain-free, then maybe they go to some of these diets, like a specific carbohydrate diet, which also takes out starches like potatoes, or maybe they need a paleo diet that takes out legumes.
And then maybe somebody might eventually need something like a ketogenic diet. But I like to teach people, I have a 12-step process to take them step by step through some of the easier diets, where people tend to have more challenges, and step up to if they need a more restrictive diet over time. And that way it's easier to see where your challenge lies and helps people not overly restricted their diet to get there. 
I also look at some of these plant-based compounds that can be very inflammatory, whether it's nightshades, or low solicitate diet – that's going to be grapes, berries, raisins, really wonderful nutrient-dense foods and spices – but if you can't process them, they can create headaches, hyperactivity and attentiveness challenges with irritability, and things like that. Or a low oxalate diet can cause a lot of inflammation in the gut and can actually disrupt and kill our beneficial bacteria. So we often think of, if we have a disrupted microbiome, the low FODMAPs diet, which I think is great. But sometimes we might even look at something like a low oxalate diet, as oxalates can also disrupt the microbiome, which a lot of people aren't aware of. We often think of oxalates associated with kidney stones. 
So these are some of the principles, and there are more diets and things, but I like to customize the diet to the individual based on really understanding what's going on with them and helping to tailor that diet.
Rebekah Kelley: Thanks, Julie, those are really valuable insights. Julie Matthews can be found at www.NourishingHope.com. And let me remind you to subscribe and get access to all Humanized videos, podcasts and transcriptions from all of our thought leaders on personalized health and HumanizedHealth.com. Thanks so much for being with us.
"
"Matthews, Julie",4/29,2,Therapeutic Diets and BioIndividual Nutrition for ADHD and Autism,yes,5/9,yes,7/2,6/23 ML,6/23 ML,6/23,6/22,6/28,6/28,6/28,7/5,,6/18/21,,"ADHD,autism,thrapeutic diet,nutrition,humanized,village green apothecary,myvillagegreen,Julie Matthews",6/18,6/21,"Therapeutic Diets and BioIndividual Nutrition for ADHD and Autism
Rebekah Kelley: Welcome to the Humanized podcast, all about personalizing your health. I'm your host, Rebekah Kelley, and I'm so excited to have a great guest today, Julie Matthews. Our topic is going to be Therapeutic Diets and BioIndividual Nutrition for ADHD and Autism. And before I introduce Julie, I want to remind everyone to subscribe, to get all of our variety of casts in audio, video and transcription at HumanizedHealth.com. I'd also like to thank our lead sponsor, Village Green Apothecary at MyVillageGreen.com. 
A little bit about Julie Matthews – she is a certified nutrition consultant and published researcher specializing in complex, neurological, digestive and immune conditions, most notably autism. She is the author of the award-winning book, Nourishing Hope for Autism and co-author of a study, ""Proving the efficacy of nutrition and dietary intervention for autism,"" published in the peer reviewed journal Nutrients. Julie's approach is based on personalized nutrition needs of each person and stems from her 20 years of clinical nutrition experience and research. Her work with a wide range of disorders for adults and children improves health and healing. Julie has a private nutrition practice in San Francisco, California, and supports families and clinicians from around the world with her nutrition learning tools and professional training courses. You can visit NourishingHope.com and BioIndividualNutrition.com to find out more.
Welcome, Julie, it's so great to have you. 
Julie Matthews: Thank you, Rebekah. I'm excited for our conversation today. 
Rebekah Kelley: So I just want to jump right in and learn more, and I would like to know of course, right away, how do food and nutrition impact ADHD and autism? 
Julie Matthews: Well, when we look at, I think the best place to start is what is underlying ADHD and autism. Cause a lot of times we hear food and diet make no difference for these conditions. And that's absolutely not true. And if we understand what's going on underneath the system, it'll make a lot more sense. 
So ADHD and autism are neurological conditions. They're not psychological disorders, they are neurological conditions where the body, the biochemistry of the body affects the brain. I like to think about it as whole body disorders, where, when we understand what's happening with the biochemistry of the whole body, we can influence what's happening in the brain. So they're not these kind of behavioral disorders necessarily, or these mysterious brain conditions, they're really whole body conditions.
And so when we look at it that way, we know that their digestion is affected. We know that their microbiome is different, and often in a negative way that influences their brain. Their immune system can be either weak in certain ways or hyper-reactive in certain ways. And when we look at that, there are things that we can do by addressing food and nutrients to influence and improve their learning, their behavior, and their overall health, as well.
Rebekah Kelley: Wow. So, what is bio-individual nutrition and how does it help? 
Julie Matthews: So bio-individual nutrition is a term that I use for the type of nutrition that I practice, and it's really personalized nutrition. And I developed it from really decades of working with families with autism and ADHD, but also related disorders. A lot of family members have depression or anxiety, or auto-immune conditions, or digestive disorders. And I realized as I was working with the child with autism, let's say, it started to help the mother that was 70 pounds overweight, or the father that had an autoimmune condition, or the uncle or sibling who had an auto-immune or some other type of digestive issue, or whatever it might be.
And so really, it's understanding that each of us are unique and we all have unique dietary and nutritional needs. And so, there are interesting studies done looking at this and seeing that even in identical twins, the way we processed foods is only about 50% influenced by our genes and then 50% influenced by our environment, and factors like sleep and stress and things.
So there's a couple things there. One, if you're in the same family and you have similar genetics, you're going to find that similar diets probably do help. But even within that, you might find that even individual family members might need slight tweaks or changes to their diet, and certainly, what helps one child with autism is going to be very different than the diet that helps another child with autism. And so I discovered as I was working with families that this, the diet of the day, I could tell you from the beginning, it was first, it was gluten-free and dairy-free, and then it was a low salicylate diet, and then it was, maybe a grain-free diet, like a specific carbohydrate diet.
Now these are all great diets because they help certain people significantly, based on what was going on biochemically for them. But what would help one client really turned out to be maybe even not only not helpful, but maybe a problem for somebody else. And they needed a different approach, but they would go on to, let's say some of these social media forums and the advocates of the diet would say, well, you're just not doing it good enough. You're not doing it hard enough. You're not doing it right. You need to do it more strictly. And then they would try even harder and cause major stress in the process. But also, it wasn't the right diet for them, so they would be getting NOT better. Sometimes they would be getting worse.
So I started to realize, after about 20 years of working with families, what symptoms are common with which food compound, which underlying biochemistry was common and affected the ability to process certain food compounds, and which diets did different people need. And I created this body of knowledge that I now refer to as the practice of BioIndividual Nutrition. 
Rebekah Kelley: Love that. Perfect for our online podcast. So what is good nutrition for ADHD and autism? Obviously, there's going to be some individual differences. But is there like a base? 
Julie Matthews: Absolutely. We know from decades of research and study, and also parents and doctors experienced that, for example, artificial ingredients are really a factor in ADHD. We know from studies, even more recent studies done in, I think, 2015 or so, recent studies looking at artificial additives causing hyperactivity in neuro-typical children. So not even children with ADHD that might have an underlying biochemistry or propensity for a reaction, but finding that just your average child will react and get hyperactive from artificial dyes and additives.
So we know that to be a factor. And we know that people with ADHD and autism have underlying biochemistry, such as poor sulfation, and methylation and some other processes, transsulfuration, that affect their ability to process these additives even further. So they're more likely, in addition, to maybe get a little hyperactive, maybe get aggression, irritability, attention issues, all sorts of different things.
So getting out the junk food, the additives, MSG, those types of things, are really important. We also know that pesticides are very commonly a problem. We've seen studies on pregnant women that get exposed to pesticides have higher rates of children with ADHD and autism. And we know pesticides are a neurotoxin. And so if they're going to kill the bug quickly, but they're going to damage our neurological system still, just more slowly. So we want to avoid things like that. 
We want to get good, healthy nutrient-dense foods, no matter who we are. I mean, we know that from babies to adults, we want to have healthy food that's going to be rich in vitamins and nutrients. 
So those are some of the things that I think apply to everybody. Getting some good quality protein in the diet. Those are all going to be good factors. And then from there, people can go and individualize their diet, depending on what they do. 
Rebekah Kelley: So what, kind of when it gets to being like a therapeutic diet, are there things that can be done to help improve learning, mood, behavior? And if so, how do you personalize a diet for someone? How do you go about that process of figuring out what's really going to be helpful?
Julie Matthews: Well, that's a really good question. I think there's a couple things we can look at. Let me start with actually, just some of the basics that anybody might look at.
We did a study that was published in the Journal of Nutrients back in 2017, looking at what factors influenced and improved people with autism. And so we looked at a multivitamin-mineral formula and essential fatty acid blend with some fish oil and some other fatty acids, looking at digestive enzymes, a few other nutrients, and a healthy gluten-free, dairy-free and soy-free diet. And we found not only improvements in autism symptoms, digestive symptoms, we found that they improved their ADHD symptoms, their attention, their focus, their mood. We found really amazing changes, including to almost seven points in nonverbal IQ and four and a half times the developmental age improvement.
So let's just start with some of the kinds of things we found, generally speaking. And so this was for autism, but we found improvements in attention, focus, cognitive improvements, anxiety, depression. In these individuals with autism, these similar things can also be found in all children and children with ADHD, as well.
So some things that people can do – getting good nutrients in their diet or getting a multivitamin-mineral formula that's high quality is really a benefit. Getting out the artificial stuff, cause we look at a healthy, gluten-free, dairy-free and soy-free diet. Then of course, removing or looking at removing, gluten, dairy and soy can be really powerful, as well. We know that they're inflammatory to the gut. We know that people with ADHD and autism have more inflammation. They often have inflammation in the gut. They often have dysbiosis in the gut. So these food proteins can really be a problem. And I think that's one of the many reasons why we see improvements.
Also they can be, they can create opiate compounds. So things like, similar to morphine or heroin – those are opiates. They fit in the opiate receptor. They might stimulate them a little bit less strongly, but they stimulate them nonetheless, so they can be very addictive foods. You'll find that kids often gravitate towards all cheese, milk, bread – things that are filled with gluten and dairy – and they can create a lot of symptoms and reactions. So one of the diets I like to look at is a gluten-free, dairy-free and soy-free diet. 
And then from there, I mentioned salicylates – or I mentioned, sulfation, early on when we were talking about artificial additives. Well, there's natural phenol compounds too, that are called salicylates and they can occur in things like fruit, like grapes and berries and ketchup. And again, these, especially the berries and things, they can be very healthy foods, but if you don't process them, which we know is a factor in ADHD and autism, the research shows they have poor sulfation and we've known this for many decades. And when they can't process them, they get hyperactive, red cheeks, red ears, irritability, aggression, and a lot of different challenges. And so sometimes a low salicylate diet can be really helpful. 
Now, my goal is always to try to address the underlying factors so that we can eat as many of these foods as possible in the future. They have good qualities to them, but in the short term, or the medium term, until we can get things balanced a bit, it can really make a profound difference. 
And then we can't go into all of them today, but things I like to teach parents in my program are looking at low histamine, low ammine, low glutamate, low oxalate, low FODMAP diet. Now not everybody is going to need or could even possibly do all of these diets, but looking at which diet is going to meet the needs of which individual. Grain-free diets – grains can be very inflammatory to the gut. So I like to look at those different diets and then tailor them based on the symptoms they have, what's going on underneath, what underlying factors are happening, what conditions they or family members might have, to help them to tailor a bio-individual diet or a personalized diet for them. 
Rebekah Kelley: Thanks, Julie, these are really valuable insights.
Julie Matthews can be found at www.NourishingHope.com. Let me remind you to subscribe and get access to all Humanized videos, podcasts and transcriptions from all of our thought leaders on personalized health@humanizedhealth.com. Thanks for being with us."
